{
 "as_of": "2026-10-24",
 "ayanamsa": "TRUE_CITRA",
 "double_transit": [
  {
   "from": "2026-10-24",
   "houses": [
    7
   ],
   "jupiter_sign": 3,
   "saturn_sign": 11,
   "to": "2026-10-30"
  },
  {
   "from": "2026-10-31",
   "houses": [
    4
   ],
   "jupiter_sign": 4,
   "saturn_sign": 11,
   "to": "2027-01-24"
  },
  {
   "from": "2027-01-25",
   "houses": [
    7
   ],
   "jupiter_sign": 3,
   "saturn_sign": 11,
   "to": "2027-06-02"
  },
  {
   "from": "2027-06-03",
   "houses": [
    5
   ],
   "jupiter_sign": 3,
   "saturn_sign": 0,
   "to": "2027-06-25"
  },
  {
   "from": "2027-06-26",
   "houses": [
    8
   ],
   "jupiter_sign": 4,
   "saturn_sign": 0,
   "to": "2027-10-19"
  },
  {
   "from": "2027-10-20",
   "houses": [
    4
   ],
   "jupiter_sign": 4,
   "saturn_sign": 11,
   "to": "2027-11-25"
  },
  {
   "from": "2027-11-26",
   "houses": [
    1,
    7,
    9
   ],
   "jupiter_sign": 5,
   "saturn_sign": 11,
   "to": "2028-02-22"
  },
  {
   "from": "2028-02-23",
   "houses": [
    5
   ],
   "jupiter_sign": 5,
   "saturn_sign": 0,
   "to": "2028-02-27"
  },
  {
   "from": "2028-02-28",
   "houses": [
    8
   ],
   "jupiter_sign": 4,
   "saturn_sign": 0,
   "to": "2028-07-23"
  },
  {
   "from": "2028-07-24",
   "houses": [
    5
   ],
   "jupiter_sign": 5,
   "saturn_sign": 0,
   "to": "2028-10-24"
  }
 ],
 "from": "2026-10-24",
 "kind": "natal_overlay",
 "lunations": [
  {
   "date": "2026-10-26",
   "kind": "full",
   "nak": "Ashwini",
   "sign": 0,
   "sign_name": "Aries"
  },
  {
   "date": "2026-11-09",
   "kind": "new",
   "nak": "Vishakha",
   "sign": 6,
   "sign_name": "Libra"
  },
  {
   "date": "2026-11-24",
   "kind": "full",
   "nak": "Krittika",
   "sign": 1,
   "sign_name": "Taurus"
  },
  {
   "date": "2026-12-09",
   "kind": "new",
   "nak": "Jyeshtha",
   "sign": 7,
   "sign_name": "Scorpio"
  },
  {
   "date": "2026-12-24",
   "kind": "full",
   "nak": "Ardra",
   "sign": 2,
   "sign_name": "Gemini"
  },
  {
   "date": "2027-01-08",
   "kind": "new",
   "nak": "Purva Ashadha",
   "sign": 8,
   "sign_name": "Sagittarius"
  },
  {
   "date": "2027-01-22",
   "kind": "full",
   "nak": "Pushya",
   "sign": 3,
   "sign_name": "Cancer"
  },
  {
   "date": "2027-02-06",
   "kind": "new",
   "nak": "Dhanishta",
   "sign": 9,
   "sign_name": "Capricorn"
  },
  {
   "date": "2027-02-21",
   "kind": "full",
   "nak": "Magha",
   "sign": 4,
   "sign_name": "Leo"
  },
  {
   "date": "2027-03-08",
   "kind": "new",
   "nak": "Purva Bhadrapada",
   "sign": 10,
   "sign_name": "Aquarius"
  },
  {
   "date": "2027-03-22",
   "kind": "full",
   "nak": "Uttara Phalguni",
   "sign": 5,
   "sign_name": "Virgo"
  },
  {
   "date": "2027-04-07",
   "kind": "new",
   "nak": "Revati",
   "sign": 11,
   "sign_name": "Pisces"
  },
  {
   "date": "2027-04-21",
   "kind": "full",
   "nak": "Chitra",
   "sign": 6,
   "sign_name": "Libra"
  }
 ],
 "natal": {
  "al_sign": 9,
  "lagna_sign": 5,
  "moon_nak": "Swati",
  "moon_sign": 6
 },
 "now": {
  "Ju": {
   "from": "2026-10-24",
   "house_from_al": 7,
   "house_from_lagna": 11,
   "house_from_moon": 10,
   "over_natal": [],
   "sign": 3,
   "sign_name": "Cancer",
   "to": "2026-10-30"
  },
  "Ke": {
   "from": "2026-10-24",
   "house_from_al": 8,
   "house_from_lagna": 12,
   "house_from_moon": 11,
   "over_natal": [],
   "sign": 4,
   "sign_name": "Leo",
   "to": "2026-12-05"
  },
  "Ma": {
   "from": "2026-10-24",
   "house_from_al": 7,
   "house_from_lagna": 11,
   "house_from_moon": 10,
   "over_natal": [],
   "sign": 3,
   "sign_name": "Cancer",
   "to": "2026-11-11"
  },
  "Me": {
   "from": "2026-10-24",
   "house_from_al": 10,
   "house_from_lagna": 2,
   "house_from_moon": 1,
   "over_natal": [
    "Mo"
   ],
   "sign": 6,
   "sign_name": "Libra",
   "to": "2026-12-01"
  },
  "Ra": {
   "from": "2026-10-24",
   "house_from_al": 2,
   "house_from_lagna": 6,
   "house_from_moon": 5,
   "over_natal": [],
   "sign": 10,
   "sign_name": "Aquarius",
   "to": "2026-12-05"
  },
  "Sa": {
   "from": "2026-10-24",
   "house_from_al": 3,
   "house_from_lagna": 7,
   "house_from_moon": 6,
   "over_natal": [],
   "sign": 11,
   "sign_name": "Pisces",
   "to": "2027-06-02"
  },
  "Su": {
   "from": "2026-10-24",
   "house_from_al": 10,
   "house_from_lagna": 2,
   "house_from_moon": 1,
   "over_natal": [
    "Mo"
   ],
   "sign": 6,
   "sign_name": "Libra",
   "to": "2026-11-15"
  },
  "Ve": {
   "from": "2026-10-24",
   "house_from_al": 10,
   "house_from_lagna": 2,
   "house_from_moon": 1,
   "over_natal": [
    "Mo"
   ],
   "sign": 6,
   "sign_name": "Libra",
   "to": "2026-11-05"
  }
 },
 "rows": [
  {
   "bav": 4,
   "from": "2026-10-24",
   "house_from_al": 10,
   "house_from_lagna": 2,
   "house_from_moon": 1,
   "influences_houses": [
    2,
    8
   ],
   "over_natal": [
    "Mo"
   ],
   "planet": "Su",
   "retro_on_entry": false,
   "sav": 28,
   "sign": 6,
   "sign_name": "Libra",
   "to": "2026-11-15"
  },
  {
   "bav": 2,
   "from": "2026-10-24",
   "house_from_al": 7,
   "house_from_lagna": 11,
   "house_from_moon": 10,
   "influences_houses": [
    2,
    5,
    6,
    11
   ],
   "over_natal": [],
   "planet": "Ma",
   "retro_on_entry": false,
   "sav": 30,
   "sign": 3,
   "sign_name": "Cancer",
   "to": "2026-11-11"
  },
  {
   "bav": 2,
   "from": "2026-10-24",
   "house_from_al": 10,
   "house_from_lagna": 2,
   "house_from_moon": 1,
   "influences_houses": [
    2,
    8
   ],
   "over_natal": [
    "Mo"
   ],
   "planet": "Me",
   "retro_on_entry": false,
   "sav": 28,
   "sign": 6,
   "sign_name": "Libra",
   "to": "2026-12-01"
  },
  {
   "bav": 4,
   "from": "2026-10-24",
   "house_from_al": 7,
   "house_from_lagna": 11,
   "house_from_moon": 10,
   "influences_houses": [
    3,
    5,
    7,
    11
   ],
   "nak_segments": [
    {
     "from": "2026-10-24",
     "nak": "Ashlesha",
     "over_natal_nak": [],
     "to": "2026-10-30"
    }
   ],
   "over_natal": [],
   "planet": "Ju",
   "retro_on_entry": false,
   "sav": 30,
   "sign": 3,
   "sign_name": "Cancer",
   "to": "2026-10-30"
  },
  {
   "bav": 5,
   "from": "2026-10-24",
   "house_from_al": 10,
   "house_from_lagna": 2,
   "house_from_moon": 1,
   "influences_houses": [
    2,
    8
   ],
   "over_natal": [
    "Mo"
   ],
   "planet": "Ve",
   "retro_on_entry": true,
   "sav": 28,
   "sign": 6,
   "sign_name": "Libra",
   "to": "2026-11-05"
  },
  {
   "bav": 5,
   "from": "2026-10-24",
   "house_from_al": 3,
   "house_from_lagna": 7,
   "house_from_moon": 6,
   "influences_houses": [
    1,
    4,
    7,
    9
   ],
   "nak_segments": [
    {
     "from": "2026-10-24",
     "nak": "Uttara Bhadrapada",
     "over_natal_nak": [],
     "to": "2027-02-07"
    },
    {
     "from": "2027-02-08",
     "nak": "Revati",
     "over_natal_nak": [],
     "to": "2027-06-02"
    }
   ],
   "over_natal": [],
   "planet": "Sa",
   "retro_on_entry": true,
   "sav": 38,
   "sign": 11,
   "sign_name": "Pisces",
   "to": "2027-06-02"
  },
  {
   "from": "2026-10-24",
   "house_from_al": 2,
   "house_from_lagna": 6,
   "house_from_moon": 5,
   "influences_houses": [
    6,
    12
   ],
   "nak_segments": [
    {
     "from": "2026-10-24",
     "nak": "Dhanishta",
     "over_natal_nak": [],
     "to": "2026-12-05"
    }
   ],
   "over_natal": [],
   "planet": "Ra",
   "retro_on_entry": true,
   "sav": 35,
   "sign": 10,
   "sign_name": "Aquarius",
   "to": "2026-12-05"
  },
  {
   "from": "2026-10-24",
   "house_from_al": 8,
   "house_from_lagna": 12,
   "house_from_moon": 11,
   "influences_houses": [
    6,
    12
   ],
   "nak_segments": [
    {
     "from": "2026-10-24",
     "nak": "Magha",
     "over_natal_nak": [],
     "to": "2026-12-05"
    }
   ],
   "over_natal": [],
   "planet": "Ke",
   "retro_on_entry": true,
   "sav": 25,
   "sign": 4,
   "sign_name": "Leo",
   "to": "2026-12-05"
  },
  {
   "bav": 4,
   "from": "2026-10-31",
   "house_from_al": 8,
   "house_from_lagna": 12,
   "house_from_moon": 11,
   "influences_houses": [
    4,
    6,
    8,
    12
   ],
   "nak_segments": [
    {
     "from": "2026-10-31",
     "nak": "Magha",
     "over_natal_nak": [],
     "to": "2027-01-24"
    }
   ],
   "over_natal": [],
   "planet": "Ju",
   "retro_on_entry": false,
   "sav": 25,
   "sign": 4,
   "sign_name": "Leo",
   "to": "2027-01-24"
  },
  {
   "bav": 5,
   "from": "2026-11-06",
   "house_from_al": 9,
   "house_from_lagna": 1,
   "house_from_moon": 12,
   "influences_houses": [
    1,
    7
   ],
   "over_natal": [
    "La"
   ],
   "planet": "Ve",
   "retro_on_entry": true,
   "sav": 27,
   "sign": 5,
   "sign_name": "Virgo",
   "to": "2026-11-21"
  },
  {
   "bav": 4,
   "from": "2026-11-12",
   "house_from_al": 8,
   "house_from_lagna": 12,
   "house_from_moon": 11,
   "influences_houses": [
    3,
    6,
    7,
    12
   ],
   "over_natal": [],
   "planet": "Ma",
   "retro_on_entry": false,
   "sav": 25,
   "sign": 4,
   "sign_name": "Leo",
   "to": "2027-03-09"
  },
  {
   "bav": 6,
   "from": "2026-11-16",
   "house_from_al": 11,
   "house_from_lagna": 3,
   "house_from_moon": 2,
   "influences_houses": [
    3,
    9
   ],
   "over_natal": [
    "Ke"
   ],
   "planet": "Su",
   "retro_on_entry": false,
   "sav": 27,
   "sign": 7,
   "sign_name": "Scorpio",
   "to": "2026-12-15"
  },
  {
   "bav": 5,
   "from": "2026-11-22",
   "house_from_al": 10,
   "house_from_lagna": 2,
   "house_from_moon": 1,
   "influences_houses": [
    2,
    8
   ],
   "over_natal": [
    "Mo"
   ],
   "planet": "Ve",
   "retro_on_entry": false,
   "sav": 28,
   "sign": 6,
   "sign_name": "Libra",
   "to": "2026-12-31"
  },
  {
   "bav": 4,
   "from": "2026-12-02",
   "house_from_al": 11,
   "house_from_lagna": 3,
   "house_from_moon": 2,
   "influences_houses": [
    3,
    9
   ],
   "over_natal": [
    "Ke"
   ],
   "planet": "Me",
   "retro_on_entry": false,
   "sav": 27,
   "sign": 7,
   "sign_name": "Scorpio",
   "to": "2026-12-21"
  },
  {
   "from": "2026-12-06",